Meanings,J Translation,English Definition,pronunciation,POS
evidence,証拠,factual proof that helps to establish the truth,ˈɛvədəns,名詞(n.)
evil,悪,Morally bad; causing harm to someone,ˈivəl,形容詞(adj.)
exam,試験,"test of your knowledge of, or ability in something",ɪgˈzæm,名詞(n.)
examination,試験,"test of your knowledge of, or ability in something",ɪgˌzæməˈneɪʃən,名詞(n.)
examine,試験をする；調べる,to test your knowledge or ability,ɪgˈzæmɪn,動詞(verb)
example,例,thing/person which represents a category,ɪgˈzæmpəl,名詞(n.)
excellent,非常に優れた,extremely good,ˈɛksələnt,形容詞(adj.)
exchange,交換する,To give things of similar value to each other,ɪksˈʧeɪnʤ,動詞(verb)
exercise,運動する,To work out to become stronger and healthier,ˈɛksərˌsaɪz,名詞(n.)
exhaust,疲れさせる,Be very very tired,ɪgˈzɑst,動詞(verb)
exist,存在する,"to be present, alive or real",ɪgˈzɪst,動詞(verb)
existence,存在,"state of being present, alive or real",ɛgˈzɪstəns,名詞(n.)
expense,費用,paying money for something (big),ɪkˈspɛns,名詞(n.)
expose,さらす；暴く,"To make visible, without covering or protection",ɪkˈspoʊz,動詞(verb)
exposure,さらすこと；暴露,state of experiencing something directly,ɪkˈspoʊʒər,名詞(n.)
extend,引き伸ばす；広げる,"To straighten or stretch something out, e.g. your leg",ɪkˈstɛnd,動詞(verb)
extreme,極端な，極度,Very great in degree,ɛkˈstrim,形容詞(adj.)
extremely,極めて,In a way that is much more than usual or expected,ɛkˈstrimli,副詞(adv)
fail,失敗する、目標に達成しない,"To not achieve a goal, or to go wrong",feɪl,動詞(verb)
faith,信仰；信頼,belief that that something is true without proof,feɪθ,名詞(n.)
faithfully,忠実に,in a trustworthy manner,ˈfeɪθfəli,副詞(adv)
familiar,よく知られた,Well-known or easily recognized,fəˈmɪljər,形容詞(adj.)
famous,有名な,widely known; recognized by many people,ˈfeɪməs,形容詞(adj.)
fan,扇風機；うちわ,thing you wave in front of your face to stay cool,fæn,名詞(n.)
fancy,好む；～したい気がする,To want to have or do something; feel like,ˈfænsi,動詞(verb)
fantastic,素晴らしい；幻想的な,"Very fanciful in design, construction, or appearance",fænˈtæstɪk,形容詞(adj.)
fascinate,魅了する,Attract or interest greatly,ˈfæsəˌneɪt,動詞(verb)
fashion,服装,style of dress or activity popular at some time,ˈfæʃən,名詞(n.)
fault,欠点,a failure or negative aspect of,fɔlt,名詞(n.)
favor,親切，好む；賛成する,helpful act of kindness,ˈfeɪvər,名詞(n.)
feature,特徴,distinctive or important point of something,ˈfiʧər,名詞(n.)
February,2月,2nd month of the year,ˈfɛbjəˌwɛri,名詞(n.)
female,女性,person of the sex that gives birth to babies,ˈfiˌmeɪl,形容詞(adj.)
fence,フェンス，囲い,wood/metal structure enclosing an area/land,fɛns,名詞(n.)
file,提出する,"To submit documents to an authority, e.g. city hall",faɪl,動詞(verb)
finance,財政；金融，資金,control of money a person/business has access to,fəˈnæns,名詞(n.)
financial,財政の；金融の,Involving money,fəˈnænʃəl,形容詞(adj.)
firm,堅い；安定した,"Fairly hard or solid, not soft",fɜrm,形容詞(adj.)
firmly,堅く；しっかりと,"in a hard, steady, unchanging way",ˈfɜrmli,副詞(adv)
flag,旗,"piece of cloth, frequently marked with a colorful symbol or sign",flæg,名詞(n.)
flash,閃光，ぴかっと光る,sudden bright light,flæʃ,名詞(n.)
flight,飛行,the act of flying,flaɪt,名詞(n.)
float,浮く,To rest on top of a surface of water or another liquid,floʊt,動詞(verb)
flood,洪水,large amount of water covering land that is usually dry,flʌd,名詞(n.)
flow,流れる,To move steadily and easily in a certain direction,floʊ,動詞(verb)
fold,折りたたむ,To bend one part of something against another part e.g. paper,foʊld,動詞(verb)
folk,人の、民族の,of ordinary people; not sophisticated,foʊk,形容詞(adj.)
fool,だます,To trick someone; to deceive,ful,動詞(verb)
foreign,外国の,Being of a different place or country,ˈfɔrən,形容詞(adj.)
forth,前へ；外へ,Outward forward,fɔrθ,副詞(adv)
fortune,運；運勢,"Chance or luck, particularly good luck",ˈfɔrʧən,名詞(n.)
frame,枠組み；骨組み，組み立てる,"Border of wood, metal, etc. in which a picture, door, pane of glass, etc. is enclosed or set",freɪm,名詞(n.)
fruit,果物,food that grows on a tree or bush,frut,名詞(n.)
fund,資金を出す,To supply money for something,fʌnd,名詞(n.)
furniture,家具,"items such as tables, chairs, beds or closets",ˈfɜrnɪʧər,名詞(n.)
future,未来,Time that is to come after the present,ˈfjuʧər,名詞(n.)
gain,得る,"To get something wanted, needed or valued",geɪn,動詞(verb)
gate,ゲート；門,place in a fence which can be opened or closed,geɪt,名詞(n.)
gather,集会を開く,To bring people/animals together into a group,ˈgæðər,動詞(verb)
gay,同性愛者,person attracted to someone of the same sex,geɪ,名詞(n.)
gear,車のギア,the transmission configuration in a vehicle,gɪr,名詞(n.)
generation,世代,People born and living at about the same time,ˌʤɛnəˈreɪʃən,名詞(n.)
gentleman,紳士,man who has good manners and is considerate,ˈʤɛntəlmən,名詞(n.)
gift,贈り物；才能,Something given to another for a reason; present,gɪft,名詞(n.)
goal,目的；目標,Something you try to do or achieve; an aim,goʊl,名詞(n.)
golf,ゴルフ,game played to hit a ball into a hole with a stick,gɑlf,名詞(n.)
grab,つかみ取る,To quickly reach out and take something in your hand.,græb,動詞(verb)
grade,学年,level of study that is completed by a student,greɪd,名詞(n.)
grand,壮大な,Including many things ; very large,grænd,形容詞(adj.)
grant,(願い・要求などを)聞き入れる；付与する,To give or let someone do what they want,grænt,動詞(verb)
grin,ニヤリと笑う,To show the teeth because you are amused ; smile,grɪn,動詞(verb)
guarantee,保証，保証する,To make a formal promise that something will happen or be done.,ˌgɛrənˈti,動詞(verb)
guard,守る；見張る，警備,to keep watch over something to protect it e.g. a bank,gɑrd,動詞(verb)
guest,客；ゲスト,person invited to visit or stay in someone's home,gɛst,名詞(n.)
guide,案内する；指導する，案内者；指導者,To lead people visiting a new or unknown place,gaɪd,動詞(verb)
guilty,有罪の,Responsible for a wrongdoing or an offense,ˈgɪlti,形容詞(adj.)
habit,習慣,usual way of behaving ; something often repeated,ˈhæbət,名詞(n.)
harm,損害，害する,"To injure, damage, or cause problems due to something you do",hɑrm,動詞(verb)
height,高さ,distance of something from the bottom to the top,haɪt,名詞(n.)
hero,英雄,person of great courage and strength who saves others,ˈhɪroʊ,名詞(n.)
hesitate,ためらう,To stop before doing something because you are unsure what to do,ˈhɛzəˌteɪt,動詞(verb)
hire,雇う,To employ a person to do a particular job or borrow something,ˈhaɪər,動詞(verb)
hook,フック，フックで吊るす,curved or bent tool,hʊk,名詞(n.)
hotel,ホテル,place where people can stay when travelling,hoʊˈtɛl,名詞(n.)
identify,確認する；同一視する,To indicate who or what someone or something is,aɪˈdɛntəˌfaɪ,動詞(verb)
identity,アイデンティティ；独自性；身元,collection of qualities that makes a person,aɪˈdɛntəti,名詞(n.)
ignore,無視する,"To not listen to, look at, or pay attention to",ɪgˈnɔr,動詞(verb)
ill,病気で，悪く,Not well or sick,ɪl,形容詞(adj.)
illegal,違法の,Not allowed by the laws or rules,ɪˈligəl,形容詞(adj.)
illness,病気,unhealthy condition of the mind or body,ˈɪlnəs,名詞(n.)
illustrate,説明する,To explain with examples to make easier to understand,ˈɪləˌstreɪt,動詞(verb)
illustration,挿絵；図解,picture that helps explain something,ˌɪləˈstreɪʃən,名詞(n.)
image,イメージ；画像,"picture, sculpture or painting of something",ˈɪməʤ,名詞(n.)
immediate,即時の；直近の,done without delay; straight away,ɪˈmidiət,形容詞(adj.)
immediately,すぐに,without any delay; straight away; right (after or before),ɪˈmidiətli,副詞(adv)
impress,よい印象を与える,To make an emotional or cognitive impact upon,ˈɪmˌprɛs,動詞(verb)
impressive,印象的な,"Causing admiration or respect; big, grand, expensive etc",ɪmˈprɛsɪv,形容詞(adj.)
improve,改善する,"To make, or become, something better",ɪmˈpruv,動詞(verb)
improvement,改善,addition or change that makes something better,ɪmˈpruvmənt,名詞(n.)
inch,インチ,1/12 of a foot (2.54 centimeters),ɪnʧ,名詞(n.)
include,含む,to make someone/something part of a group,ɪnˈklud,動詞(verb)
income,収入,"Earned money from work, investments or business",ˈɪnˌkʌm,名詞(n.)
increase,増える；増加させる,to make or become something larger in size or amount,ˈɪnˌkris,動詞(verb)
increasingly,ますます,more and more; in greater degree or amount,ɪnˈkrisɪŋli,副詞(adv)
indicate,指し示す,"To show something, direct attention to or point out",ˈɪndəˌkeɪt,動詞(verb)
indication,表示；兆候,Something that signals that something else exists or will happen,ˌɪndəˈkeɪʃən,名詞(n.)
individual,個人，個人の,"single person, looked at separately from others",ˌɪndəˈvɪʤəwəl,名詞(n.)
industrial,産業の,Concerning industry or people involved in industry,ɪnˈdʌstriəl,形容詞(adj.)
industry,産業,Factories or businesses that make certain products,ˈɪndəstri,名詞(n.)
influence,影響を与える，影響,to affect what happens; change something (indirectly),ˈɪnfluəns,動詞(verb)
injure,傷つける,Do physical harm or damage,ˈɪnʤər,動詞(verb)
injury,傷害,Physical or emotional harm or damage that a person experiences,ˈɪnʤəri,名詞(n.)
innocent,無邪気な；無罪の,Free from evil or guilt,ˈɪnəsənt,形容詞(adj.)
insist,主張する,To strongly state your opinion without changing it,ɪnˈsɪst,動詞(verb)
instance,例；実例,an example of something; case,ˈɪnstəns,名詞(n.)
instruction,指示；教育,information about how to do or use something,ɪnˈstrʌkʃən,名詞(n.)
instrument,楽器,device that is used for creating music,ˈɪnstrəmənt,名詞(n.)
intend,～するつもりである,To plan or want to do something,ɪnˈtɛnd,動詞(verb)
intense,激しい,"Very strong, great or extreme in degree",ɪnˈtɛns,形容詞(adj.)
intention,意図,aim or purpose,ɪnˈtɛnʧən,名詞(n.)
interview,面接；インタビュー,To formally ask questions about a given topic,ˈɪntərˌvju,動詞(verb)
introduce,紹介する,to make someone known to another by name,ˌɪntrəˈdus,動詞(verb)
introduction,紹介,making someone known to another by name,ˌɪntrəˈdʌkʃən,名詞(n.)
investigate,調査する,To try to find out facts; to carry out research,ɪnˈvɛstəˌgeɪt,動詞(verb)
investigation,調査,search for information about something,ɪnˌvɛstəˈgeɪʃən,名詞(n.)
invitation,招待,"when someone asks another to attend an event, etc",ˌɪnvɪˈteɪʃən,名詞(n.)
invite,招待する；勧める,To ask someone to go somewhere or do something,ɪnˈvaɪt,動詞(verb)
iron,アイロン，アイロンをかける,hot heavy metal object used to smoothen clothes,ˈaɪərn,名詞(n.)
item,事項；項目,"distinct, individual thing, often part of a group",ˈaɪtəm,名詞(n.)
jacket,ジャケット；カバー,"light, thin coat worn on the upper body over another shirt or piece of clothing for protection or warmth",ˈʤækət,名詞(n.)
journey,旅,act of traveling from one place to another ; trip,ˈʤɜrni,名詞(n.)
joy,喜び,feeling of great happiness and pleasure,ʤɔɪ,名詞(n.)
July,7月,7th month of the year,ˌʤuˈlaɪ,名詞(n.)
justice,公正,"quality of being fair, equal, or just",ˈʤʌstəs,名詞(n.)
keen,鋭い,Being eager or excited for something to happen,kin,形容詞(adj.)
knee,膝,Middle part of your leg that bends,ni,名詞(n.)
knife,ナイフ；刀,long piece of metal you use for cutting things,naɪf,名詞(n.)
knowledge,知識,"Information, understanding, or skill",ˈnɑləʤ,名詞(n.)
labor,労働，働く；詳細に論じる,To work hard (often physically) for many hours,ˈleɪbər,動詞(verb)
laboratory,研究室,workplace for the conduct of scientific research,ˈlæbrəˌtɔri,名詞(n.)
lack,不足，欠いている,"to not have, or not have enough, of something",læk,動詞(verb)
language,言語,words or signs used to communicate messages,ˈlæŋgwəʤ,名詞(n.)
lawyer,弁護士,professional who helps people with the law,ˈlɔjər,名詞(n.)
league,同盟；リーグ ,association of sports teams that organizes matches for its members,lig,名詞(n.)
leap,飛び跳ねる，跳躍,To move forwards often in big steps,lip,動詞(verb)
legal,合法的な；法的な,Concerning the law; allowed by law,ˈligəl,形容詞(adj.)
lend,貸す,to give to someone for a while before it is returned,lɛnd,動詞(verb)
length,長さ,measurement of distance or of time,lɛŋkθ,名詞(n.)
lesson,授業；課,something done to learn or teach something; class,ˈlɛsən,名詞(n.)
library,図書館,place where books and other media are kept,ˈlaɪˌbrɛri,名詞(n.)
license,免許,official certificate which grants a person permission to do or have something,ˈlaɪsəns,名詞(n.)
likely,ありそうな；～しそうである；適した,referring to the chance that something will actually happen,ˈlaɪkli,形容詞(adj.)
limit,限度；境界，制限する,point beyond which it is not possible to go,ˈlɪmət,名詞(n.)
limitation,制限；限界,act of controlling or reducing the size of something,ˌlɪmɪˈteɪʃən,名詞(n.)
loan,貸す，貸付,To borrow money that must be paid back,loʊn,動詞(verb)
locate,捜し出す；置く；位置する,"To find a certain place, location, or destination",ˈloʊˌkeɪt,動詞(verb)
location,場所,particular position or area,loʊˈkeɪʃən,名詞(n.)
log,丸太,piece of a tree that has fallen or been cut,lɔg,名詞(n.)
loose,ゆるい；自由な,Not tightly attached or held,lus,形容詞(adj.)
loss,失うこと；損害,experience or state of failing to have or keep,lɔs,名詞(n.)
magazine,雑誌,weekly or monthly publication with pictures and stories,ˈmægəˌzin,名詞(n.)
magic,手品；魔法,Any art that invokes supernatural powers,ˈmæʤɪk,名詞(n.)
mail,郵便；メール,"a letter, package or email",meɪl,名詞(n.)
maintain,維持する；持続する,"To keep, exist or continue without changing",meɪnˈteɪn,動詞(verb)
maintenance,維持；整備,keeping (a machine) working by checking and fixing it,ˈmeɪntənəns,名詞(n.)
male,男性,Characteristic of boys or men,meɪl,形容詞(adj.)
manner,方法,That way that something happens or is done,ˈmænər,名詞(n.)
map,地図,picture showing the geography of an area,mæp,名詞(n.)
mass,質量,Having to do with a large amount of people,mæs,名詞(n.)
massive,巨大な；大量の,Very big large too big,ˈmæsɪv,形容詞(adj.)
match,試合,"a sports competition between two people or teams
",mæʧ,名詞(n.)
mate,仲間,"Someone who you work, live, or go to school with",meɪt,名詞(n.)
material,材料，物質,substance from which a thing is made of,məˈtɪriəl,名詞(n.)
mathematics,数学,study or science of numbers and shapes,ˌmæθəˈmætɪks,名詞(n.) 複数形(pl.)
maximum,最大,largest or greatest,ˈmæksəməm,名詞(n.)
measure,測る;寸法をとる,"To calculate size, weight or temperature of",ˈmɛʒər,動詞(verb)
measurement,測定,size or amount of something or someone,ˈmɛʒərmənt,名詞(n.)
meat,肉；,flesh of a dead animal that you eat,mit,名詞(n.)
medical,医療の,of or relating to physical health or medicine,ˈmɛdəkəl,形容詞(adj.)
medicine,薬,a substance used in treating illness or pain,ˈmɛdəsən,名詞(n.)
memory,記憶,Something that has been remembered,ˈmɛməri,名詞(n.)
mental,精神の,Concerning the mind,ˈmɛntəl,形容詞(adj.)
message,メッセージ；伝言,piece of information that is told/given to someone,ˈmɛsəʤ,名詞(n.)
metal,金属,Usually hard shiny material mined from rock,ˈmɛtəl,名詞(n.)
meter,メートル,unit of length equal to 100cm or about 39 inches,ˈmitər,名詞(n.)
military,軍隊，軍の,Concerning soldiers or the armed forces,ˈmɪləˌtɛri,名詞(n.)
minor,小さい；少ない；重要でない,"Not so large in size, not important or valuable",ˈmaɪnər,形容詞(adj.)
minority,少数派,part that is less than half of the whole; a small part,maɪˈnɔrəti,名詞(n.)
mirror,鏡,thing with a glass surface used to look at yourself,ˈmɪrər,名詞(n.)
mission,任務,a special assignment that is given to a person or group,ˈmɪʃən,名詞(n.)
mix,混ぜる,To combine two or more things to make one,mɪks,動詞(verb)
model,模型を作る，模範となる,To make a small scale copy of a full original,ˈmɑdəl,形容詞(adj.)
modern,現代の,of the present time; up to date; contemporary,ˈmɑdərn,形容詞(adj.)
mood,気分；ムード,emotion or a state of mind; how you feel,mud,名詞(n.)
moon,月,round object circling the Earth at night,mun,名詞(n.)
motor,"自動車の,動力を起こす",concerning cars and vehicles,ˈmoʊtər,形容詞(adj.)
mount,登る；乗る；取り付ける,To attach to a support,maʊnt,動詞(verb)
mouse,ネズミ,small animal that has fur and a long tail,maʊs,名詞(n.)
murder,殺人，殺す,crime of deliberately killing a person,ˈmɜrdər,名詞(n.)
muscle,筋肉,One of the contractile soft organs of the body,ˈmʌsəl,名詞(n.)
mystery,謎；ミステリー,"book, play, or film that deals with a solution of a strange crime",ˈmɪstəri,名詞(n.)
narrow,狭い,Not wide ; short from one side to the other,ˈnɛroʊ,形容詞(adj.)
native,ネイティブ；母語話者,person speaking a language from birth,ˈneɪtɪv,名詞(n.)
neither,どちらも～ない,Not one or the other not either none of two things,ˈniðər,形容詞(adj.)
nerve,神経,fibers in the body that enable feeling and movement,nɜrv,名詞(n.)
nervous,神経質な；緊張して,Having a tendency to become uneasy or anxious,ˈnɜrvəs,形容詞(adj.)
newspaper,新聞,Sheets of paper (or online) containing news stories,ˈnuzˌpeɪpər,名詞(n.)
nor,～もまた～でない,Used to show two things that are both untrue or do not happen,nɔr,接続詞(conj.)
northern,北の,in or toward the north,ˈnɔrðərn,形容詞(adj.)
November,11月,11th month of the year,noʊˈvɛmbər,名詞(n.)
nowhere,どこにも～ない,Not in or at any place; no place,ˈnoʊˌwɛr,副詞(adv)
object,反対する,to disagree; to protest against an idea or plan,ˈɑbʤɛkt,動詞(verb)
observation,観察；監視,remark or comment on something you noticed,ˌɑbzərˈveɪʃən,名詞(n.)
observe,観察する,to watch carefully; to make a comment,əbˈzɜrv,動詞(verb)
occasion,時；出来事；機会,time when something happens or takes place,əˈkeɪʒən,名詞(n.)
occasionally,時折に,not very often; sometimes; seldom,əˈkeɪʒənəli,副詞(adv)
occur,発生する,To come to pass or to happen,əˈkɜr,動詞(verb)
October,10月,10th month of the year,ɑkˈtoʊbər,名詞(n.)
official,公式な；公的な,of or done by someone in authority; formal,əˈfɪʃəl,形容詞(adj.)
operate,作動する；操作する；作用する；経営する,To be working or being used,ˈɑpəˌreɪt,動詞(verb)
operation,作用；操作；事業,Functioning; use,ˌɑpəˈreɪʃən,名詞(n.)
operator,操作者；(電話の)交換手；経営者,person whose job it is to connect phone calls,ˈɑpəˌreɪtər,名詞(n.)
opinion,意見,a person's thoughts on a topic,əˈpɪnjən,名詞(n.)
opportunity,機会,time/situation when a thing might be done; chance,ˌɑpərˈtunəti,名詞(n.)
oppose,反対する,"To fight against someone in a contest, game or fight",əˈpoʊz,動詞(verb)
opposite,反対側の,Across from or on the side facing something,ˈɑpəzət,形容詞(adj.)
opposition,反対,act of disagreeing or trying to stop something,ˌɑpəˈzɪʃən,名詞(n.)
ordinary,普通の,Normal or usual,ˈɔrdəˌnɛri,形容詞(adj.)
organization,組織,formal group of people with a particular purpose,ˌɔrgənəˈzeɪʃən,名詞(n.)
organize,組織する；まとめる；計画する,"To arrange and plan things, e.g. a party",ˈɔrgəˌnaɪz,動詞(verb)
original,最初の；原始的な；独創的な，原物,"being first made, thought or performed; fresh",əˈrɪʤənəl,形容詞(adj.)
originally,もともと,At first; in the beginning,əˈrɪʤənəli,副詞(adv)
otherwise,さもなければ；別のやり方で，他の,"indicates that there will be a bad result if something is done, not done, or done improperly",ˈʌðərˌwaɪz,副詞(adv)
owe,借りがある；義務がある；おかげである,To need to pay or repay money,oʊ,動詞(verb)
panic,恐慌；パニック,overwhelming feeling of fear and anxiety,ˈpænɪk,名詞(n.)
partner,パートナー；相棒,someone you have a business or personal relationship with,ˈpɑrtnər,名詞(n.)
partnership,協力関係,working with others for some purpose,ˈpɑrtnərˌʃɪp,名詞(n.)
path,小道；通り道,track made with stones/by walking over the ground,pæθ,名詞(n.)
patient,辛抱強い,not getting annoyed when things take a long time,ˈpeɪʃənt,形容詞(adj.)
pattern,模範；原型；模様；傾向；パターン,regular repeated behavior,ˈpætərn,名詞(n.)
pause,休止，休止する,To stop doing for a while before continuing,pɔz,動詞(verb)
peace,平和,time when there is no war or fighting,pis,名詞(n.)
pen,ペン,Something you write with in ink,pɛn,名詞(n.)
pension,年金,regular payments you receive after you retire,ˈpɛnʃən,名詞(n.)
per,～につき； ～ごとに,For each; during each,pɜr,前置詞(prep.)
percent,パーセント,One one-hundredth of a whole,pərˈsɛnt,名詞(n.)
percentage,パーセンテージ；割合,part of a whole divided into hundredths,pərˈsɛntəʤ,名詞(n.)
perform,行う；成し遂げる,To carry out an action well or successfully,pərˈfɔrm,動詞(verb)
performance,演奏；公演,activity done to entertain an audience,pərˈfɔrməns,名詞(n.)
period,期間；時代,set amount of time during which events take place,ˈpɪriəd,名詞(n.)
physical,身体の；肉体の,Concerning the body of a person,ˈfɪzɪkəl,形容詞(adj.)
piano,ピアノ,keyboard instrument used for playing music,piˈænoʊ,名詞(n.)
pig,ブタ,animal that bacon comes from,pɪg,名詞(n.)
pile,積み重ねる，積み重ね,group of things one on top of another,paɪl,名詞(n.)
pink,ピンク,One of the colors people can see:,pɪŋk,形容詞(adj.)
pipe,管；パイプ,"tube a round, hollow piece of metal, plastic, or wood",paɪp,名詞(n.)
pitch,ボールを投げる，投球,black substance that is sticky when it is hot and very hard when it is dry,pɪʧ,名詞(n.)
plain,地味な；質素な；明白な,very simple/ordinary; not decorated; not striped,pleɪn,形容詞(adj.)
plane,飛行機；平面；平らな；水準,an airplane,pleɪn,名詞(n.)
planet,惑星,One of the bodies that orbit the sun,ˈplænət,名詞(n.)
plastic,プラスチック,"stiff but usually come; what flexible man-made material, usually made using a hydrocarbon-based polymer",ˈplæstɪk,名詞(n.)
plate,皿,flat dish used for eating or serving food,pleɪt,名詞(n.)
pleasant,気持ちのよい,Causing a good feeling,ˈplɛzənt,形容詞(adj.)
pleasure,楽しさ；愉快；満足,"feeling of happiness, enjoyment, or satisfaction",ˈplɛʒər,名詞(n.)
pocket,ポケット,small cloth bag sewn into clothing to hold things,ˈpɑkət,名詞(n.)
poem,詩,"a written composition in verse, not prose",ˈpoʊəm,名詞(n.)
poet,詩人,person who writes poems,ˈpoʊət,名詞(n.)
poetry,詩,poetic writing; imaginative verses,ˈpoʊətri,名詞(n.)
policy,政策；方針,"course of action proposed by an organization, etc",ˈpɑləsi,名詞(n.)
political,政治の,Concerning government or public affairs,pəˈlɪtəkəl,形容詞(adj.)
politician,政治家,someone who is active in politics,ˌpɑləˈtɪʃən,名詞(n.)
politics,政治,Activities influencing the policies of a government,ˈpɑləˌtɪks,名詞(n.) 複数形(pl.)
pollution,汚染,act or result of releasing dirty or dangerous substances into an environment,pəˈluʃən,名詞(n.)
pool,プール,large container or hole that is filled with water and used for people to swim in,pul,名詞(n.)
popular,人気のある,liked or enjoyed by many people,ˈpɑpjələr,形容詞(adj.)
population,人口,"number of people who live in a country, area etc",ˌpɑpjəˈleɪʃən,名詞(n.)
port,港,"place along a coast where ships load and unload things or passengers, or be sheltered during a storm",pɔrt,名詞(n.)
positive,確かな；肯定的な；前向きな,"Good or useful in qualities, constructive, confident",ˈpɑzətɪv,形容詞(adj.)
possess,所有する；取り憑く,to have or own something,pəˈzɛs,動詞(verb)
possession,所有物,Having or owning something,pəˈzɛʃən,名詞(n.)
potato,じゃがいも,edible tuber vegetable,pəˈteɪˌtoʊ,名詞(n.)
pour,注ぐ,To make something flow in a steady stream,pɔr,動詞(verb)
