Meanings,J Translation,English Definition,pronunciation,POS
enable,可能にする,To make it possible to do something,ɛˈneɪbəl,動詞(verb)
encounter,出会う，出会い,To unexpectedly be faced with or experience,ɪnˈkaʊntər,動詞(verb)
enhance,高める；強化する,Make effect to increase or improve,ɛnˈhæns,動詞(verb)
ensure,保証する；確保する,"To make something sure, certain, or safe",ɛnˈʃʊr,動詞(verb)
enterprise,企業； 事業； 企て,Willingness to take new ventures; initiative; business organization; plan,ˈɛntərˌpraɪz,名詞(n.)
entitle,資格をあたえる; 題名をつける,To give a right to someone,ɛnˈtaɪtəl,動詞(verb)
entrance,入り口；入場,way into a place,ˈɛntrəns,名詞(n.)
entry,入場,act of entering,ˈɛntri,名詞(n.)
episode,エピソード；出来事,show which is part of a larger story,ˈɛpəˌsoʊd,名詞(n.)
equation,方程式,mathematical statement showing things to be equal,ɪˈkweɪʒən,名詞(n.)
equivalent,同等の；相当する，同等物,"Having equality in value, use or meaning",ɪˈkwɪvələnt,形容詞(adj.)
era,時代,"period of time that is characterized by particular events, qualities, conditions, or individuals",ˈɛrə,名詞(n.)
error,エラー；誤り,Something that is not correct; a mistake,ˈɛrər,名詞(n.)
essay,小論文; エッセイ,short written work that displays someone's opinions or beliefs regarding a particular subject,ˈɛˌseɪ,名詞(n.)
essential,不可欠な；本質的な,Extremely important and necessary,ɪˈsɛnʃəl,形容詞(adj.)
estimate,見積もり,"guess or calculation of cost, size or value",ˈɛstəmət,名詞(n.)
ethnic,民族的な,Connected with people who shares a cultural tradition,ˈɛθnɪk,形容詞(adj.)
evaluate,評価する,To form an idea to judge something carefully,ɪˈvæljuˌeɪt,動詞(verb)
evaluation,評価,judgment about the value or condition of something,ɪˌvæljuˈeɪʃən,名詞(n.)
evolution,進化,scientific theory that states that plants and animals change slowly over time according to the environments they live in,ˌɛvəˈluʃən,名詞(n.)
evolve,進化する； 発展する,To slowly change or develop into something better,ɪˈvɑlv,動詞(verb)
exceed,超える,To be greater in number than something,ɪkˈsid,動詞(verb)
exception,例外,Something different or not included,ɪkˈsɛpʃən,名詞(n.)
excess,過剰，過度の,amount that is more than necessary,ˈɛkˌsɛs,名詞(n.)
exclude,除外する,To prevent someone from access to a group,ɪkˈsklud,動詞(verb)
executive,幹部,a senior manager in a business or organization,ɪgˈzɛkjətɪv,名詞(n.)
exhibit,展示する；表す,To display or make available for people to see,ɪgˈzɪbɪt,動詞(verb)
exhibition,展示；展覧会,public event at which an object or group of objects is put on display for people to look at,ˌɛksəˈbɪʃən,名詞(n.)
expand,拡大する,To become bigger or larger in size and amount,ɪkˈspænd,動詞(verb)
expansion,拡大,act of EXPANDING or becoming bigger,ɪkˈspænʃən,名詞(n.)
expenditure,支出；費用,amount of money used during a certain time,ɪkˈspɛndəʧər,名詞(n.)
experiment,実験,test performed to assess new ideas or theories,ɪkˈspɛrəmənt,名詞(n.)
experimental,実験的な,using techniques that are different or untried before,ɪkˌspɛrɪˈmɛntəl,形容詞(adj.)
expert,専門家,skillful person with special knowledge,ˈɛkspərt,名詞(n.)
explore,探索する,To examine something in detail to learn about it,ɪkˈsplɔr,動詞(verb)
export,輸出する,To send goods to be sold in another country,ˈɛkspɔrt,動詞(verb)
extension,時間延長,extra time allowed to complete something,ɪkˈstɛnʃən,名詞(n.)
extensive,"広い；広範囲の, 多方面にわたる；大規模な",Large; full or complete,ɪkˈstɛnsɪv,形容詞(adj.)
extent,範囲；広がり,range or space included in something,ɪkˈstɛnt,名詞(n.)
external,外部の,Outside of something,ɪkˈstɜrnəl,形容詞(adj.)
extract,引き出す、抽出する、取り除く,Take something out of something else,ˈɛkˌstrækt,名詞(n.)
extraordinary,異常な,Beyond what is ordinary; very unusual; remarkable,ɪkˈstrɔrdəˌnɛri,形容詞(adj.)
facility,施設,piece of equipment or buildings with a special use,fəˈsɪlɪti,名詞(n.)
factor,要因,Something that influences a result,ˈfæktər,名詞(n.)
factory,工場,building where things are made,ˈfæktəri,名詞(n.)
fade,しぼむ；色あせる,To lose strength or freshness,feɪd,動詞(verb)
failure,失敗；落第；不足,act or result of not achieving your goals,ˈfeɪljər,名詞(n.)
false,うその,Not real or genuine,fɔls,限定詞(det.)
federal,連邦,system of government,ˈfɛdərəl,形容詞(adj.)
fee,料金,amount of money paid for a particular service,fi,名詞(n.)
festival,祭り,cultural event with a program of events,ˈfɛstəvəl,名詞(n.)
fiction,架空；フィクション,"book or story including ideas , people and events that are not real",ˈfɪkʃən,名詞(n.)
filter,ろ過器；フィルター，ろ過する；フィルターにかける,device that removes unwanted substances from a liquid or gas,ˈfɪltər,名詞(n.)
flexible,柔軟な,Capable of being easily bent changed without breaking,ˈflɛksəbəl,形容詞(adj.)
focus,焦点,main purpose or center of interest or activity,ˈfoʊkəs,名詞(n.)
forecast,予報,"prediction of some future thing, e.g. the weather",ˈfɔrˌkæst,名詞(n.)
formal,正装の,behaving well/politely; wearing your best clothes,ˈfɔrməl,形容詞(adj.)
format,体裁；形式,"form, design, or arrangement of something",ˈfɔrˌmæt,名詞(n.)
formation,形成,"process of creating, or making into a particular shape",fɔrˈmeɪʃən,名詞(n.)
former,前の，前者,"being something previously, but not now",ˈfɔrmər,限定詞(det.)
formula,方法、解決策、公式,"plan, rule or method for doing or making something",ˈfɔrmjələ,名詞(n.)
foundation,土台,underground base on which building is constructed,faʊnˈdeɪʃən,名詞(n.)
fragment,破片,part that is broken off of something,ˈfrægmənt,名詞(n.)
framework,構成；構想,basic structure of something,ˈfreɪmˌwɜrk,名詞(n.)
frequency,頻度,How often something happens,ˈfrikwənsi,名詞(n.)
frequent,頻繁な,Happening often,ˈfrikwənt,形容詞(adj.)
frequently,頻繁に,Often; regularly,ˈfrikwəntli,副詞(adv)
fuel,燃料,material used to produce heat or power when burned,ˈfjuəl,名詞(n.)
fulfill,満たす；果たす,To do something that was promised or required,fʊlˈfɪl,動詞(verb)
function,機能,what something is intended to be used for; purpose,ˈfʌŋkʃən,名詞(n.)
functional,機能的な,useful; not just for decoration,ˈfʌŋkʃənəl,形容詞(adj.)
fundamental,基本的な,"Forming a necessary part, base, or core",ˌfʌndəˈmɛntəl,形容詞(adj.)
furthermore,さらに,In addition to what has been said,ˈfɜrðərˌmɔr,副詞(adv)
gallery,画廊,place to look at various types of art,ˈgæləri,名詞(n.)
gap,すきま；相違,distance between two objects,gæp,名詞(n.)
gaze,凝視,direction you are looking,geɪz,名詞(n.)
gender,性別,state of being male or female,ˈʤɛndər,名詞(n.)
gene,遺伝子,part of cell in a that controls the development and appearance of a living thing,ʤin,名詞(n.)
generate,生み出す,To create or be produced or bring into existence,ˈʤɛnəˌreɪt,動詞(verb)
genetic,遺伝の,"Concerning GENES or the scientific study of how a living thing's appearance, growth, and development are determined and transferred between generations",ʤəˈnɛtɪk,形容詞(adj.)
genuine,本物の、誠実な,"Being real, actual, and not false or artificial",ˈʤɛnjəwən,形容詞(adj.)
gesture,身振り；ジェスチャー,"bodily movement that expresses a particular meaning, idea, or emotion",ˈʤɛsʧər,名詞(n.)
global,世界的な,"Concerning, affecting, or involving the entire world",ˈgloʊbəl,形容詞(adj.)
gradually,徐々に,Occurring in a slow manner over a period of time,ˈgræʤuəli,副詞(adv)
graduate,卒業する，卒業生，大学院の,Concerning university courses taken after receiving a four-year degree,ˈgræʤuɪt,形容詞(adj.)
grain,粒；穀物,seeds of plants used for food,greɪn,名詞(n.)
grateful,感謝している,Feeling or showing thanks; thankful,ˈgreɪtfəl,形容詞(adj.)
greet,挨拶する；出迎える,To meet someone with friendly words and actions ; to welcome,grit,動詞(verb)
guideline,指針,"rule, instruction or principle",ˈgaɪˌdlaɪn,名詞(n.)
guitar,ギター,stringed musical instrument played with the fingers,gɪˈtɑr,名詞(n.)
harbor,港,area of water protected by land and used by ships,ˈhɑrbər,名詞(n.)
hence,それ故,"From now, later than the present time",hɛns,副詞(adv)
highlight,見所；ハイライト，強調する,best or most interesting part of something,ˈhaɪˌlaɪt,名詞(n.)
hint,ほのめかす，ヒント,"To indicate what you think, feel, know without saying it directly",hɪnt,動詞(verb)
host,主人，開催する,person who is entertains guests,hoʊst,名詞(n.)
household,家庭 ; 世帯,Concerning a house,ˈhaʊsˌhoʊld,名詞(n.)
humor,ユーモア,quality that makes something funny,ˈhjumər,名詞(n.)
hypothesis,仮説,idea that leads to further study or discussion,haɪˈpɑθəsəs,名詞(n.) 複数形(pl.)
immigrant,移民,person moving to another country to live there,ˈɪməgrənt,名詞(n.)
implement,実行する,tool,ˈɪmpləmənt,名詞(n.)
implementation,履行；実施,act of implementing (providing a practical means for accomplishing something); carrying into effect,ˌɪmpləmɛnˈteɪʃən,名詞(n.)
implication,含意,possible effects or results from an action or event,ˌɪmpləˈkeɪʃən,名詞(n.)
imply,暗に意味する,"to suggest something, without saying it directly",ɪmˈplaɪ,動詞(verb)
import,輸入する，輸入,To bring Items or GOODS from one country into another,ˈɪmpɔrt,動詞(verb)
importance,重要性,being important; having a big effect on,ɪmˈpɔrtəns,名詞(n.)
impose,課す；強いる,To make someone to do or endure something,ɪmˈpoʊz,動詞(verb)
impression,印象,effect or feeling resulting from an experience,ɪmˈprɛʃən,名詞(n.)
incentive,刺激；動因,Something that encourages a person to work hard,ɪnˈsɛntɪv,名詞(n.)
incident,事件,"event, usually unusual or important",ˈɪnsədənt,名詞(n.)
incorporate,合併する；組み込む；法人組織化する,To include or involve as part of something else,ɪnˈkɔrpərɪt,動詞(verb)
independence,独立,having the freedom to make your own decisions,ˌɪndɪˈpɛndəns,名詞(n.)
independent,独立した,making your own decisions; not controlled by others,ˌɪndɪˈpɛndənt,形容詞(adj.)
index,索引；目録；指針,written or printed (usually alphabetical) list,ˈɪndɛks,名詞(n.)
infant,幼児,child in the beginning stage of life; a baby,ˈɪnfənt,名詞(n.)
infection,感染症,act or state of becoming INFECTED with a disease,ɪnˈfɛkʃən,名詞(n.)
inflation,インフレーション ；膨張,continual rise in the prices of products,ɪnˈfleɪʃən,名詞(n.)
initial,最初の，頭文字,Existing or occurring at the beginning,ɪˈnɪʃəl,形容詞(adj.)
initially,初めは,At first; originally,ɪˈnɪʃəli,副詞(adv)
initiative,構想；戦略,ability to decide or act upon things yourself without depending on someone else,ɪˈnɪʃətɪv,名詞(n.)
innovation,革新,new invention or idea that is created,ˌɪnəˈveɪʃən,名詞(n.)
input,入力；インプット,"To put in information, advice or opinions",ˈɪnˌpʊt,動詞(verb)
inquiry,問い合わせ；質問；調査,request for information,ɪnˈkwaɪri,名詞(n.)
insight,洞察,very good understanding of something a clear idea about how something works,ˈɪnˌsaɪt,名詞(n.)
inspire,刺激を与える；触発する,To make someone have the desire to do something,ɪnˈspaɪr,動詞(verb)
install,導入する；設置する；インストールする,To set up a piece of EQUIPMENT so that it is ready to use,ɪnˈstɔl,動詞(verb)
institution,機関; 施設,organization created for a particular cause or purpose,ˌɪnstɪˈtuʃən,名詞(n.)
institutional,制度の,Being related or similar to an institution,ˌɪnstɪˈtuʃənəl,形容詞(adj.)
integrate,統合する,to combine together; make into one thing,ˈɪntəˌgreɪt,動詞(verb)
intellectual,知的な,person who uses the mind intelligently,ˌɪntəˈlɛkʧuəl,名詞(n.)
intelligence,知能,ability to learn things or to consider situations,ɪnˈtɛləʤəns,名詞(n.)
interaction,相互作用；交流,process of two or more people or things affecting each other; the process of INTERACTING,ˌɪntəˈrækʃən,名詞(n.)
interior,内部；室内；インテリア,Being the inside part of something; being inside something,ɪnˈtɪriər,形容詞(adj.)
internal,内部の,Within or inside,ɪnˈtɜrnəl,形容詞(adj.)
international,国際的な,"done or relating to several countries, not just your own",ˌɪntərˈnæʃənəl,形容詞(adj.)
interpret,通訳する,to translate what is said into another language,ɪnˈtɜrprət,動詞(verb)
interpretation,解釈,explanation of the meaning of something,ɪnˌtɜrprɪˈteɪʃən,名詞(n.)
intervention,介入；仲裁,act of coming between two or more parties in a situation or disagreement to try to change the result,ˌɪntərˈvɛnʧən,名詞(n.)
invent,発明する,To create something useful for the first time,ɪnˈvɛnt,動詞(verb)
invest,投資する,To use resources to build for the future,ɪnˈvɛst,動詞(verb)
investment,投資,something purchased hoping its value will increase,ɪnˈvɛstmənt,名詞(n.)
investor,投資家,person who spends money to help business grow,ɪnˈvɛstər,名詞(n.)
isolate,隔離する；孤立させる,To keep in a place or situation apart from others,ˈaɪsəˌleɪt,動詞(verb)
jail,刑務所,place to hold criminals being punished for a crime,ʤeɪl,名詞(n.)
joint,継ぎ目,point at which two things meet (e.g. a road),ʤɔɪnt,名詞(n.)
journal,新聞；雑誌；定期刊行物,book in which brief daily accounts of events are written,ˈʤɜrnəl,名詞(n.)
journalist,ジャーナリスト,"person who writes news reports for newspapers, magazines, television, or radio",ˈʤɜrnələst,名詞(n.)
jury,陪審；審査員,"group of 12 citizens who listen to information about the problem or crime, receive instructions from the judge, and decide the guilt or innocence of the person on trial",ˈʤʊri,名詞(n.)
justify,正当化する,To give reasons why you did something or why it is right,ˈʤʌstəˌfaɪ,動詞(verb)
label,ラベル，ラベルをつける；名前をつける,a piece of paper or material to identify something,ˈleɪbəl,名詞(n.)
landscape,風景,natural scenery of a place,ˈlændˌskeɪp,名詞(n.)
latter,後の，後者,the second or last mentioned thing,ˈlætər,限定詞(det.)
laughter,笑い,action or sound of laughing,ˈlæftər,名詞(n.)
launch,始める；発射する,to put a rocket into the air; put a ship into the water,lɔnʧ,動詞(verb)
layer,層,one of several sheets of a material or object,ˈleɪər,名詞(n.)
leather,革；革製品,"chemically tanned animal skin, e.g. for shoes",ˈlɛðər,名詞(n.)
lecture,講演する，講演,talk or speech about a particular subject,ˈlɛkʧər,名詞(n.)
legislation,法律制定,act or process of writing and passing laws,ˌlɛʤəˈsleɪʃən,名詞(n.)
liability,責任；負債,"something that is owed to someone else, e.g. a debt",ˌlaɪəˈbɪlɪti,名詞(n.)
liberal,自由主義の,Believing government should actively support social needs,ˈlɪbərəl,形容詞(adj.)
link,つなぐ；連結する，輪,To join or connect together,lɪŋk,動詞(verb)
liquid,液体,basic state of things that is similar to water; not solid or gas,ˈlɪkwəd,名詞(n.)
literally,文字通り,In a way that expresses the exact or LITERAL meaning of something,ˈlɪtərəli,副詞(adv)
literary,文学の,Concerning or concerned with literature,ˈlɪtəˌrɛri,形容詞(adj.)
literature,文学；文献,"Writings that are valued as works of art, esp. fiction, drama and poetry",ˈlɪtərəʧər,名詞(n.)
logic,論理,"proper, valid sensible reasoning",ˈlɑʤɪk,名詞(n.)
luxury,豪華さ；贅沢品,Something expensive or costly that is not needed which is bought for pleasure,ˈlʌgʒəri,名詞(n.)
majority,大多数,amount that is more than half of a group,məˈʤɔrəti,名詞(n.)
manufacture,製造，製造する,to produce large numbers of products in a factory,ˌmænjəˈfækʧər,動詞(verb)
manufacturer,製造業者；メーカー,group or company that makes a certain product,ˌmænjəˈfækʧərər,名詞(n.)
margin,余白；縁；限界；利益,"edge or border of a page on above, below",ˈmɑrʤən,名詞(n.)
mature,成熟した,"Being an adult, being fully developed physically",məˈʧʊr,形容詞(adj.)
mayor,市長,head of city government,ˈmeɪər,名詞(n.)
meanwhile,その間に；一方では,At or during the same time ; in the meantime,ˈminˌwaɪl,副詞(adv)
mechanism,機構；メカニズム,piece of machinery,ˈmɛkəˌnɪzəm,名詞(n.)
medium,中間；媒体；手段；マスコミ機関,"middle size, something between other things",ˈmidiəm,名詞(n.)
menu,メニュー,list of dishes available at a restaurant,ˈmɛnju,名詞(n.)
mere,単なる,Just enough,mɪr,形容詞(adj.)
merely,単に,"Only, simply, or nothing more than",ˈmɪrli,副詞(adv)
method,方法,(organized and planned) way of doing something,ˈmɛθəd,名詞(n.)
minimum,最小限,lowest number or amount that is possible,ˈmɪnəməm,名詞(n.)
mixture,混合,Something made by combining two or more things,ˈmɪksʧər,名詞(n.)
mobile,携帯電話,Capable of moving from one place to another,ˈmoʊbəl,形容詞(adj.)
mode,状態；方法,way of acting or doing something,moʊd,名詞(n.)
moderate,適度の,Average in size or amount,ˈmɑdərət,形容詞(adj.)
modify,変更する,To make minor change to something,ˈmɑdəˌfaɪ,動詞(verb)
module,モジュール,part or unit with a specific job,ˈmɑʤul,名詞(n.)
monitor,モニター,electronic screen on which you can see images,ˈmɑnətər,名詞(n.)
moral,道徳；モラル,in a way considered proper and good by most people,ˈmɔrəl,形容詞(adj.)
moreover,さらに,In addition to what has been said,mɔˈroʊvər,副詞(adv)
mortgage,抵当；住宅ローン,long-term loan from a bank for buying property,ˈmɔrgəʤ,名詞(n.)
motion,動き,a movement; the process of moving,ˈmoʊʃən,名詞(n.)
motivate,やる気にさせる,to make someone enthusiastic about doing something,ˈmoʊtəˌveɪt,動詞(verb)
motivation,動機；モチベーション,mental drive in a person that makes him or her do something,ˌmoʊtəˈveɪʃən,名詞(n.)
multiple,複数の,Having or involving more than one of something,ˈmʌltəpəl,形容詞(adj.)
museum,博物館,"building to display art, science, or history objects",mjuˈziəm,名詞(n.)
mutual,互いの; 交互の,Shared between two or more people,ˈmjuʧuəl,形容詞(adj.)
narrative,物語,the telling of a story,ˈnærətɪv,名詞(n.)
negative,否定の；後ろ向きの，否定；拒否,"Being harmful, unwanted or unhelpful",ˈnɛgətɪv,形容詞(adj.)
neglect,無視する；怠る,To fail to take care of something,nəˈglɛkt,動詞(verb)
negotiate,交渉する,To have a formal discussion to reach an agreement,nəˈgoʊʃiˌeɪt,動詞(verb)
negotiation,交渉,a formal discussion to reach an agreement,nɪˌgoʊʃiˈeɪʃən,名詞(n.)
net,網；ネット,crossed rope/fibers with partly open pattern,nɛt,名詞(n.)
network,ネットワーク；網,system of connections,ˈnɛˌtwɜrk,名詞(n.)
nevertheless,それにもかかわらず,in spite of what has just been said; nonetheless,ˌnɛvərðəˈlɛs,副詞(adv)
notion,概念,idea or opinion about doing something,ˈnoʊʃən,名詞(n.)
novel,小説,written fiction story,ˈnɑvəl,名詞(n.)
nuclear,核の；原子力の,Concerning or involving the center of an ATOM,ˈnukliər,形容詞(adj.)
numerous,多くの,Existing in large numbers,ˈnumərəs,形容詞(adj.)
objective,目標,something you decide you want to do; goal,əbˈʤɛktɪv,名詞(n.)
obligation,義務,"duty that must be performed because of a law, rule, agreement, or promise",ˌɑbləˈgeɪʃən,名詞(n.)
occupy,占める,"To fill a time, a space, or an area",ˈɑkjəˌpaɪ,動詞(verb)
ocean,海,large body of salt water that covers most of the surface of the earth,ˈoʊʃən,名詞(n.)
offense,犯罪；攻撃,criminal act; something that causes hurt,əˈfɛns,名詞(n.)
opera,オペラ ,play with music in which all the words are sung,ˈɑprə,名詞(n.)
opponent,対戦相手；反対者,person that you are competing against in a game or contest,əˈpoʊnənt,名詞(n.)
organic,有機体の；オーガニック,Concerning food made with few or no chemicals,ɔrˈgænɪk,形容詞(adj.)
origin,起源,point at which something begins or is created,ˈɔrəʤən,名詞(n.)
outcome,結果,"Something that happens as a result, consequence",ˈaʊtˌkʌm,名詞(n.)
outline,概要，概要を述べる,To overview or summarize the important points of something,ˈaʊtˌlaɪn,動詞(verb)
output,生産；出力,amount of something that is produced,ˈaʊtˌpʊt,名詞(n.)
overall,全部の；総合的な，全体として,"Viewed as a whole; in general, not as details",ˈoʊvəˌrɔl,形容詞(adj.)
overcome,克服する,To succeed in a struggle against; defeat,ˈoʊvərˌkʌm,動詞(verb)
overseas,海外；海外の,In or to a foreign country that is across a sea,ˈoʊvərˈsiz,副詞(adv)
pace,ペース；一歩；速度,rate of speed at which someone or something moves or happens,peɪs,名詞(n.)
pale,青白い；淡い,Light in color,peɪl,形容詞(adj.)
panel,パネル；委員会,group of people who answer questions or give opinions,ˈpænəl,名詞(n.)
paragraph,段落,section of writing that usually deals with one subject,ˈpærəˌgræf,名詞(n.)
parallel,平行な，平行線,Very similar and often occurring at the same time,ˈpɛrəˌlɛl,形容詞(adj.)
participant,参加者,person who is actively involved and included in something,pɑrˈtɪsəpənt,名詞(n.)
participate,参加する,To take part with others in doing something,pɑrˈtɪsəˌpeɪt,動詞(verb)
participation,参加,act of being involved in something,pɑrˌtɪsəˈpeɪʃən,名詞(n.)
passage,通路；通過,narrow path or space through which people or objects can go through,ˈpæsəʤ,名詞(n.)
passenger,乗客,person who is travelling in a vehicle,ˈpæsənʤər,名詞(n.)
passion,情熱,"powerful, positive feeling about something",ˈpæʃən,名詞(n.)
peak,頂点に達する,Being at the highest or best level of something,pik,名詞(n.)
peer,対等者；同級生；貴族,"person of the same age, class or background as another",pɪr,名詞(n.)
penalty,罰,Punishment for committing a crime or offense,ˈpɛnəlti,名詞(n.)
perceive,知覚する；気づく,To notice or become aware of something,pərˈsiv,動詞(verb)
perception,知覚；認知,way in which one sees or understands something,pərˈsɛpʃən,名詞(n.)
permanent,永続的な,Lasting forever ; not temporary or changing,ˈpɜrmənənt,形容詞(adj.)
permission,許可,right to do something as allowed by another,pərˈmɪʃən,名詞(n.)
permit,許可する,To allow something to happen; to give permission,ˈpɜrˌmɪt,動詞(verb)
personality,個性；性格,person_s unique character; the way that a person usually acts,ˌpɜrsəˈnælɪti,名詞(n.)
personnel,人事部；人員,group of people who work for a company,ˌpɜrsəˈnɛl,名詞(n.)
perspective,視点；遠近法,"way of thinking, an attitude toward something",pərˈspɛktɪv,名詞(n.)
persuade,説得する,"to get you to do/believe something, by giving reasons",pərˈsweɪd,動詞(verb)
phase,段階,distinct part or step in a process,feɪz,名詞(n.)
phenomenon,現象,fact that can observed and studied,fəˈnɑməˌnɑn,名詞(n.)
philosophy,哲学,study of ideas about the fundamental nature of life,fəˈlɑsəfi,名詞(n.)
phrase,言い回し；語句,group of words that forms a unit and expresses a single meaning,freɪz,名詞(n.)
pilot,飛行士；パイロット，操縦する；導く,Performed to see if a larger or more detailed thing should be done,ˈpaɪlət,名詞(n.)
platform,プラットフォーム；台,"flat, raised structure that people stand on",ˈplætˌfɔrm,名詞(n.)
plot,企み；陰謀，たくらむ,"To plan something in secret, often something bad",plɑt,動詞(verb)
poll,投票；世論調査,process of gathering people's opinions about something by asking a question or series of questions about a particular subject,poʊl,名詞(n.)
portion,部分,part of a whole,ˈpɔrʃən,名詞(n.)
portrait,肖像,"painting, drawing or photograph of a person's head and shoulders",ˈpɔrtrət,名詞(n.)
pose,姿勢；ポーズ，ポーズをとる,to put someone in a position to be photographed,poʊz,動詞(verb)
potential,可能性，潜在的な,capable of happening or becoming reality,pəˈtɛnʃəl,形容詞(adj.)
potentially,潜在的に,that could happen or become reality,pəˈtɛnʃəli,副詞(adv)
poverty,貧困,state of being poor,ˈpɑvərti,名詞(n.)
praise,称賛，称賛する,To express approval of something or someone,preɪz,動詞(verb)
precise,精密な；正確な,Very accurate and exact expression or detail,prɪˈsaɪs,形容詞(adj.)
